### ISSUE TITLE
10.7.5 - Network flooded with multicast packages

### ISSUE THREAD

**Issue by Tezzlicious** [jellyfin/jellyfin#5981]
This morning my jellyfin container updated itself to 10.7.5. When I woke up I noticed my network was having a hard time (devices disconnected). I could see a lot of congestion on my WiFi. After tcpdump on my access points I traced it back to jellyfin.

Reverting to 10.7.2 fixed it for now.

**System (please complete the following information):**
 - OS: Ubuntu 18
 - Virtualization: Docker
 - Clients: Browser/AndroidTV/iOS
 - Browser: Safari/Chrome
 - Jellyfin Version: 10.7.5 (now back to 10.7.2)
 - Playback: [Direct Play, Remux, Direct Stream, Transcode] 
 - Installed Plugins: -
 - Reverse Proxy: nginx
 - Base URL: none
 - Networking: macvlan
 - Storage: local

**To Reproduce**
Update container to 10.7.5

tcpdump -i eth0 multicast

**Expected behavior**
No flood on multicast

**Logs**
.xx being my jellyfin container:

12:28:08.044835 IP 192.168.1.xx.1900 > 239.255.255.250.1900: UDP, length 94
12:28:08.044985 IP 192.168.1.xx.44582 > 239.255.255.250.1900: UDP, length 142
12:28:08.045548 IP 192.168.1.xx.1900 > 239.255.255.250.1900: UDP, length 94
12:28:08.045551 IP 192.168.1.xx.44582 > 239.255.255.250.1900: UDP, length 94
12:28:08.045656 IP 192.168.1.xx.1900 > 239.255.255.250.1900: UDP, length 142
12:28:08.045948 IP 192.168.1.xx.1900 > 239.255.255.250.1900: UDP, length 94
12:28:08.045949 IP 192.168.1.xx.44582 > 239.255.255.250.1900: UDP, length 94
12:28:08.046296 IP 192.168.1.xx.44582 > 239.255.255.250.1900: UDP, length 142
12:28:08.046706 IP 192.168.1.xx.1900 > 239.255.255.250.1900: UDP, length 94
12:28:08.046708 IP 192.168.1.xx.44582 > 239.255.255.250.1900: UDP, length 94
12:28:08.046795 IP 192.168.1.xx.1900 > 239.255.255.250.1900: UDP, length 142
12:28:08.047193 IP 192.168.1.xx.44582 > 239.255.255.250.1900: UDP, length 94
12:28:08.047194 IP 192.168.1.xx.1900 > 239.255.255.250.1900: UDP, length 94
12:28:08.047304 IP 192.168.1.xx.1900 > 239.255.255.250.1900: UDP, length 142
12:28:08.051474 IP 192.168.1.xx.1900 > 239.255.255.250.1900: UDP, length 94
12:28:08.051474 IP 192.168.1.xx.44582 > 239.255.255.250.1900: UDP, length 94
12:28:08.051619 IP 192.168.1.xx.1900 > 239.255.255.250.1900: UDP, length 142
12:28:08.051640 IP 192.168.1.xx.44582 > 239.255.255.250.1900: UDP, length 142
12:28:08.051684 IP 192.168.1.xx.1900 > 239.255.255.250.1900: UDP, length 142
12:28:08.051699 IP 192.168.1.xx.44582 > 239.255.255.250.1900: UDP, length 142
12:28:08.051871 IP 192.168.1.xx.1900 > 239.255.255.250.1900: UDP, length 94
12:28:08.052215 IP 192.168.1.xx.44582 > 239.255.255.250.1900: UDP, length 94
12:28:08.052593 IP 192.168.1.xx.1900 > 239.255.255.250.1900: UDP, length 94
12:28:08.053339 IP 192.168.1.xx.1900 > 239.255.255.250.1900: UDP, length 94
12:28:08.053341 IP 192.168.1.xx.44582 > 239.255.255.250.1900: UDP, length 94
12:28:08.053465 IP 192.168.1.xx.1900 > 239.255.255.250.1900: UDP, length 142
12:28:08.053466 IP 192.168.1.xx.44582 > 239.255.255.250.1900: UDP, length 142
12:28:08.053527 IP 192.168.1.xx.44582 > 239.255.255.250.1900: UDP, length 142
12:28:08.053533 IP 192.168.1.xx.1900 > 239.255.255.250.1900: UDP, length 142
12:28:08.053788 IP 192.168.1.xx.44582 > 239.255.255.250.1900: UDP, length 94
12:28:08.053789 IP 192.168.1.xx.1900 > 239.255.255.250.1900: UDP, length 94
12:28:08.054484 IP 192.168.1.xx.44582 > 239.255.255.250.1900: UDP, length 142
12:28:08.054485 IP 192.168.1.xx.1900 > 239.255.255.250.1900: UDP, length 94
12:28:08.055244 IP 192.168.1.xx.1900 > 239.255.255.250.1900: UDP, length 94
12:28:08.055287 IP 192.168.1.xx.44582 > 239.255.255.250.1900: UDP, length 94
12:28:08.055404 IP 192.168.1.xx.1900 > 239.255.255.250.1900: UDP, length 142
12:28:08.055421 IP 192.168.1.xx.44582 > 239.255.255.250.1900: UDP, length 142

**Additional context**
I'm on UniFi UDM Pro with UniFi 6 Lite Access Points. I have Block LAN to WLAN multicast disabled for other reasons.

**Comment by crobibero** [comment]
Can you please post Jellyfin logs? The tcpdump is great but not helpful.

**Comment by Tezzlicious** [comment]
Here you go. First startup is 10.7.2 (everything OK) and second one 10.7.5. I stopped the 10.7.5 instance at the moment I saw the flooding start via tcpdump.

```
[2021-05-05 14:44:36.196 +02:00] [INF] [1] Main: Jellyfin version: "10.7.2"
[2021-05-05 14:44:36.245 +02:00] [INF] [1] Main: Environment Variables: ["[JELLYFIN_LOG_DIR, /config/log]", "[JELLYFIN_DATA_DIR, /config/data]", "[DOTNET_SYSTEM_GLOBALIZATION_INVARIANT, 1]", "[JELLYFIN_CACHE_DIR, /config/cache]", "[JELLYFIN_CONFIG_DIR, /config]"]
[2021-05-05 14:44:36.252 +02:00] [INF] [1] Main: Arguments: ["/usr/lib/jellyfin/bin/jellyfin.dll", "--ffmpeg=/usr/lib/jellyfin-ffmpeg/ffmpeg", "--webdir=/usr/share/jellyfin/web"]
[2021-05-05 14:44:36.254 +02:00] [INF] [1] Main: Operating system: "Linux"
[2021-05-05 14:44:36.255 +02:00] [INF] [1] Main: Architecture: X64
[2021-05-05 14:44:36.257 +02:00] [INF] [1] Main: 64-Bit Process: True
[2021-05-05 14:44:36.257 +02:00] [INF] [1] Main: User Interactive: True
[2021-05-05 14:44:36.257 +02:00] [INF] [1] Main: Processor count: 4
[2021-05-05 14:44:36.257 +02:00] [INF] [1] Main: Program data path: "/config/data"
[2021-05-05 14:44:36.257 +02:00] [INF] [1] Main: Web resources path: "/usr/share/jellyfin/web"
[2021-05-05 14:44:36.257 +02:00] [INF] [1] Main: Application directory: "/usr/lib/jellyfin/bin/"
[2021-05-05 14:44:36.744 +02:00] [INF] [1] Emby.Server.Implementations.AppBase.BaseConfigurationManager: Setting cache path: "/config/cache"
[2021-05-05 14:44:36.869 +02:00] [INF] [1] Jellyfin.Networking.Manager.NetworkManager: Defined LAN addresses : "[127.0.0.1/8,10.0.0.0/8,172.16.0.0/12,192.168.0.0/16]"
[2021-05-05 14:44:36.869 +02:00] [INF] [1] Jellyfin.Networking.Manager.NetworkManager: Defined LAN exclusions : "[]"
[2021-05-05 14:44:36.871 +02:00] [INF] [1] Jellyfin.Networking.Manager.NetworkManager: Using LAN addresses: "[127.0.0.1/8,10.0.0.0/8,172.16.0.0/12,192.168.0.0/16]"
[2021-05-05 14:44:36.875 +02:00] [INF] [1] Jellyfin.Networking.Manager.NetworkManager: Using bind addresses: "[]"
[2021-05-05 14:44:36.875 +02:00] [INF] [1] Jellyfin.Networking.Manager.NetworkManager: Using bind exclusions: "[]"
[2021-05-05 14:44:37.005 +02:00] [INF] [1] Emby.Server.Implementations.ApplicationHost: Loading assemblies
[2021-05-05 14:44:37.027 +02:00] [INF] [1] Emby.Server.Implementations.Plugins.PluginManager: Loaded assembly "Emby.AutoOrganize, Version=9.0.0.0, Culture=neutral, PublicKeyToken=null" from "/config/data/plugins/Auto Organize_9.0.0.0/Emby.AutoOrganize.dll"
[2021-05-05 14:44:37.032 +02:00] [INF] [1] Emby.Server.Implementations.Plugins.PluginManager: Loaded assembly "LiteDB, Version=4.1.4.0, Culture=neutral, PublicKeyToken=4ee40123013c9f27" from "/config/data/plugins/Kodi Sync Queue_6.0.0.0/LiteDB.dll"
[2021-05-05 14:44:37.034 +02:00] [INF] [1] Emby.Server.Implementations.Plugins.PluginManager: Loaded assembly "Jellyfin.Plugin.KodiSyncQueue, Version=6.0.0.0, Culture=neutral, PublicKeyToken=null" from "/config/data/plugins/Kodi Sync Queue_6.0.0.0/Jellyfin.Plugin.KodiSyncQueue.dll"
[2021-05-05 14:44:37.035 +02:00] [INF] [1] Emby.Server.Implementations.Plugins.PluginManager: Loaded assembly "Jellyfin.Plugin.OpenSubtitles, Version=10.0.0.0, Culture=neutral, PublicKeyToken=null" from "/config/data/plugins/Open Subtitles_10.0.0.0/Jellyfin.Plugin.OpenSubtitles.dll"
[2021-05-05 14:44:37.037 +02:00] [INF] [1] Emby.Server.Implementations.Plugins.PluginManager: Loaded assembly "OpenSubtitlesHandler, Version=0.0.0.0, Culture=neutral, PublicKeyToken=null" from "/config/data/plugins/Open Subtitles_10.0.0.0/OpenSubtitlesHandler.dll"
[2021-05-05 14:44:37.040 +02:00] [INF] [1] Emby.Server.Implementations.Plugins.PluginManager: Loaded assembly "TvDbSharper, Version=3.2.2.0, Culture=neutral, PublicKeyToken=null" from "/config/data/plugins/TheTVDB_4.0.0.0/TvDbSharper.dll"
[2021-05-05 14:44:37.045 +02:00] [INF] [1] Emby.Server.Implementations.Plugins.PluginManager: Loaded assembly "Jellyfin.Plugin.Tvdb, Version=4.0.0.0, Culture=neutral, PublicKeyToken=null" from "/config/data/plugins/TheTVDB_4.0.0.0/Jellyfin.Plugin.Tvdb.dll"
[2021-05-05 14:44:37.048 +02:00] [INF] [1] Emby.Server.Implementations.Plugins.PluginManager: Loaded assembly "Trakt, Version=11.0.0.0, Culture=neutral, PublicKeyToken=null" from "/config/data/plugins/Trakt_11.0.0.0/Trakt.dll"
[2021-05-05 14:44:37.060 +02:00] [INF] [1] Emby.Server.Implementations.Plugins.PluginManager: Loaded assembly "Handlebars, Version=2.0.4.0, Culture=neutral, PublicKeyToken=22225d0bf33cd661" from "/config/data/plugins/Webhook_2.2021.409.38/Handlebars.dll"
[2021-05-05 14:44:37.111 +02:00] [INF] [1] Emby.Server.Implementations.Plugins.PluginManager: Loaded assembly "BouncyCastle.Crypto, Version=1.8.8.0, Culture=neutral, PublicKeyToken=0e99375e54769942" from "/config/data/plugins/Webhook_2.2021.409.38/BouncyCastle.Crypto.dll"
[2021-05-05 14:44:37.126 +02:00] [INF] [1] Emby.Server.Implementations.Plugins.PluginManager: Loaded assembly "MimeKit, Version=2.10.0.0, Culture=neutral, PublicKeyToken=bede1c8a46c66814" from "/config/data/plugins/Webhook_2.2021.409.38/MimeKit.dll"
[2021-05-05 14:44:37.130 +02:00] [INF] [1] Emby.Server.Implementations.Plugins.PluginManager: Loaded assembly "Jellyfin.Plugin.Webhook, Version=2.2021.409.38, Culture=neutral, PublicKeyToken=null" from "/config/data/plugins/Webhook_2.2021.409.38/Jellyfin.Plugin.Webhook.dll"
[2021-05-05 14:44:37.148 +02:00] [INF] [1] Emby.Server.Implementations.Plugins.PluginManager: Loaded assembly "MailKit, Version=2.10.0.0, Culture=neutral, PublicKeyToken=4e064fe7c44a8f1b" from "/config/data/plugins/Webhook_2.2021.409.38/MailKit.dll"
[2021-05-05 14:44:44.221 +02:00] [INF] [1] Emby.Server.Implementations.Plugins.PluginManager: Loaded plugin: "Auto Organize" "9.0.0.0"
[2021-05-05 14:44:44.225 +02:00] [INF] [1] Jellyfin.Plugin.KodiSyncQueue.Data.DbRepo: Jellyfin.Plugin.KodiSyncQueue is now starting
[2021-05-05 14:44:44.226 +02:00] [INF] [1] Jellyfin.Plugin.KodiSyncQueue.Data.DbRepo: Creating DB Repository...
[2021-05-05 14:44:44.254 +02:00] [INF] [1] Emby.Server.Implementations.Plugins.PluginManager: Loaded plugin: "Kodi Sync Queue" "6.0.0.0"
[2021-05-05 14:44:44.255 +02:00] [INF] [1] Emby.Server.Implementations.Plugins.PluginManager: Loaded plugin: "Open Subtitles" "10.0.0.0"
[2021-05-05 14:44:44.257 +02:00] [INF] [1] Emby.Server.Implementations.Plugins.PluginManager: Loaded plugin: "TheTVDB" "4.0.0.0"
[2021-05-05 14:44:44.259 +02:00] [INF] [1] Emby.Server.Implementations.Plugins.PluginManager: Loaded plugin: "Trakt" "11.0.0.0"
[2021-05-05 14:44:44.262 +02:00] [INF] [1] Emby.Server.Implementations.Plugins.PluginManager: Loaded plugin: "Webhook" "2.2021.409.38"
[2021-05-05 14:44:44.263 +02:00] [INF] [1] Emby.Server.Implementations.Plugins.PluginManager: Loaded plugin: "OMDb" "10.7.2.0"
[2021-05-05 14:44:44.264 +02:00] [INF] [1] Emby.Server.Implementations.Plugins.PluginManager: Loaded plugin: "MusicBrainz" "10.7.2.0"
[2021-05-05 14:44:44.265 +02:00] [INF] [1] Emby.Server.Implementations.Plugins.PluginManager: Loaded plugin: "AudioDB" "10.7.2.0"
[2021-05-05 14:44:44.526 +02:00] [INF] [1] Main: Kestrel listening on "Any IP4 Address"
[2021-05-05 14:44:45.332 +02:00] [WRN] [1] Microsoft.AspNetCore.DataProtection.Repositories.EphemeralXmlRepository: Using an in-memory repository. Keys will not be persisted to storage.
[2021-05-05 14:44:45.333 +02:00] [WRN] [1] Microsoft.AspNetCore.DataProtection.KeyManagement.XmlKeyManager: Neither user profile nor HKLM registry available. Using an ephemeral key repository. Protected data will be unavailable when application exits.
[2021-05-05 14:44:45.361 +02:00] [WRN] [1] Microsoft.AspNetCore.DataProtection.KeyManagement.XmlKeyManager: No XML encryptor configured. Key {2e5ec12d-ca31-4631-b9fb-c78f8a83fade} may be persisted to storage in unencrypted form.
[2021-05-05 14:44:45.443 +02:00] [INF] [1] Emby.Server.Implementations.ApplicationHost: Running startup tasks
[2021-05-05 14:44:45.446 +02:00] [INF] [1] Jellyfin.Plugin.KodiSyncQueue.ScheduledTasks.FireRetentionTask: Retention Task Scheduled!
[2021-05-05 14:44:45.601 +02:00] [INF] [1] Emby.Server.Implementations.ScheduledTasks.TaskManager: Daily trigger for "Remove Old Sync Data" set to fire at 05/06/2021 00:01, which is 9:16:14.3990684 from now.
[2021-05-05 14:44:45.641 +02:00] [INF] [1] Emby.Server.Implementations.ScheduledTasks.TaskManager: Daily trigger for "Hoofdstukafbeeldingen Uitpakken" set to fire at 05/06/2021 02:00, which is 11:15:14.3584414 from now.
[2021-05-05 14:44:45.766 +02:00] [INF] [1] MediaBrowser.MediaEncoding.Encoder.MediaEncoder: Found ffmpeg version "4.3.2"
[2021-05-05 14:44:45.868 +02:00] [INF] [1] MediaBrowser.MediaEncoding.Encoder.MediaEncoder: Available "decoders": ["h264", "h264_qsv", "h264_cuvid", "hevc", "hevc_qsv", "hevc_cuvid", "mpeg2video", "mpeg2_qsv", "mpeg2_cuvid", "mpeg4", "mpeg4_cuvid", "msmpeg4", "vc1_qsv", "vc1_cuvid", "vp8_cuvid", "vp8_qsv", "vp9_cuvid", "vp9_qsv", "aac", "ac3", "flac", "mp3"]
[2021-05-05 14:44:45.893 +02:00] [INF] [1] MediaBrowser.MediaEncoding.Encoder.MediaEncoder: Available "encoders": ["libx264", "h264_amf", "h264_nvenc", "h264_qsv", "h264_v4l2m2m", "h264_vaapi", "libx265", "hevc_amf", "hevc_nvenc", "hevc_qsv", "hevc_vaapi", "mpeg4", "msmpeg4", "libvpx", "libvpx-vp9", "aac", "ac3", "flac", "libmp3lame", "libopus", "libvorbis", "srt"]
[2021-05-05 14:44:45.915 +02:00] [INF] [1] MediaBrowser.MediaEncoding.Encoder.MediaEncoder: Available hwaccel types: ["vdpau", "cuda", "vaapi", "qsv", "drm", "opencl"]
[2021-05-05 14:44:45.917 +02:00] [INF] [1] MediaBrowser.MediaEncoding.Encoder.MediaEncoder: FFmpeg: Custom: "/usr/lib/jellyfin-ffmpeg/ffmpeg"
[2021-05-05 14:44:45.919 +02:00] [INF] [1] Emby.Server.Implementations.ApplicationHost: ServerId: "22a8705c1a264ef9a7ec8161e3775f33"
[2021-05-05 14:44:46.195 +02:00] [INF] [1] Emby.Server.Implementations.ApplicationHost: Executed all pre-startup entry points in 0:00:00.2311945
[2021-05-05 14:44:46.195 +02:00] [INF] [1] Emby.Server.Implementations.ApplicationHost: Core startup complete
[2021-05-05 14:44:46.204 +02:00] [INF] [1] Emby.AutoOrganize.Data.SqliteFileOrganizationRepository: SQLite version: "3.33.0"
[2021-05-05 14:44:46.206 +02:00] [INF] [1] Emby.AutoOrganize.Data.SqliteFileOrganizationRepository: SQLite compiler options: "COMPILER=gcc-5.4.0 20160609,DEFAULT_FOREIGN_KEYS,ENABLE_COLUMN_METADATA,ENABLE_FTS3_PARENTHESIS,ENABLE_FTS4,ENABLE_FTS5,ENABLE_JSON1,ENABLE_RTREE,THREADSAFE=1"
[2021-05-05 14:44:46.212 +02:00] [INF] [1] Emby.AutoOrganize.Data.SqliteFileOrganizationRepository: Default journal_mode for "/config/data/data/fileorganization.db" is "wal"
[2021-05-05 14:44:46.214 +02:00] [INF] [1] Emby.AutoOrganize.Data.SqliteFileOrganizationRepository: PRAGMA synchronous="1"
[2021-05-05 14:44:46.281 +02:00] [INF] [1] Jellyfin.Plugin.KodiSyncQueue.EntryPoints.LibrarySyncNotification: LibrarySyncNotification Startup...
[2021-05-05 14:44:46.284 +02:00] [INF] [1] Jellyfin.Plugin.KodiSyncQueue.EntryPoints.UserSyncNotification: UserSyncNotification Startup...
[2021-05-05 14:44:46.869 +02:00] [INF] [6] Emby.Server.Implementations.HttpServer.WebSocketManager: WS "192.168.1.1" request
[2021-05-05 14:44:46.883 +02:00] [INF] [1] Emby.Server.Implementations.IO.LibraryMonitor: Skipping realtime monitor for "/*****" because the path does not exist
[2021-05-05 14:44:46.885 +02:00] [WRN] [6] Jellyfin.Server.Middleware.ResponseTimeMiddleware: Slow HTTP Response from "https://*****/socket?api_key=d029ce739c9c43399b33b43afa4eff6c&deviceId=TW96aWxsYS81LjAgKE1hY2ludG9zaDsgSW50ZWwgTWFjIE9TIFggMTBfMTVfNikgQXBwbGVXZWJLaXQvNjA1LjEuMTUgKEtIVE1MLCBsaWtlIEdlY2tvKSBWZXJzaW9uLzE0LjAuMyBTYWZhcmkvNjA1LjEuMTV8MTYyMDIxMTA2ODc1NA11" to "192.168.1.1" in 0:00:00.5395016 with Status Code 101
[2021-05-05 14:44:46.887 +02:00] [INF] [1] Emby.Server.Implementations.EntryPoints.ExternalPortForwarding: Starting NAT discovery
[2021-05-05 14:44:46.894 +02:00] [INF] [4] Emby.Server.Implementations.IO.LibraryMonitor: Watching directory /*****
[2021-05-05 14:44:46.917 +02:00] [INF] [4] Emby.Server.Implementations.IO.LibraryMonitor: Watching directory /*****
[2021-05-05 14:44:46.929 +02:00] [INF] [4] Emby.Server.Implementations.IO.LibraryMonitor: Watching directory /*****
[2021-05-05 14:44:46.951 +02:00] [INF] [4] Emby.Server.Implementations.IO.LibraryMonitor: Watching directory /*****
[2021-05-05 14:44:46.970 +02:00] [INF] [4] Emby.Server.Implementations.IO.LibraryMonitor: Watching directory /*****
[2021-05-05 14:44:46.980 +02:00] [INF] [4] Emby.Server.Implementations.IO.LibraryMonitor: Watching directory /*****
[2021-05-05 14:44:47.021 +02:00] [INF] [12] Emby.Server.Implementations.IO.LibraryMonitor: Watching directory/*****
[2021-05-05 14:44:47.025 +02:00] [INF] [4] Emby.Server.Implementations.IO.LibraryMonitor: Watching directory /*****
[2021-05-05 14:44:47.031 +02:00] [INF] [4] Emby.Server.Implementations.IO.LibraryMonitor: Watching directory /*****
[2021-05-05 14:44:47.053 +02:00] [INF] [11] Emby.Server.Implementations.IO.LibraryMonitor: Watching directory /*****
[2021-05-05 14:44:47.066 +02:00] [INF] [1] Emby.Server.Implementations.ApplicationHost: Executed all post-startup entry points in 0:00:00.8700045
[2021-05-05 14:44:47.066 +02:00] [INF] [1] Main: Startup complete 0:00:11.521597
[2021-05-05 14:44:48.652 +02:00] [INF] [6] Emby.Server.Implementations.ScheduledTasks.TaskManager: "StartupTrigger" fired for task: "Update Plugins"
[2021-05-05 14:44:48.655 +02:00] [INF] [6] Emby.Server.Implementations.ScheduledTasks.TaskManager: Queuing task "PluginUpdateTask"
[2021-05-05 14:44:48.664 +02:00] [INF] [11] Emby.Server.Implementations.ScheduledTasks.TaskManager: Executing "Update Plugins"
[2021-05-05 14:44:50.243 +02:00] [INF] [11] Emby.Server.Implementations.ScheduledTasks.TaskManager: "Update Plugins" Completed after 0 minute(s) and 1 seconds
[2021-05-05 14:44:50.322 +02:00] [INF] [11] Emby.Server.Implementations.ScheduledTasks.TaskManager: ExecuteQueuedTasks
[2021-05-05 14:45:45.603 +02:00] [INF] [6] Emby.Server.Implementations.ScheduledTasks.TaskManager: "IntervalTrigger" fired for task: "Webhook Item Added Notifier"
[2021-05-05 14:45:45.604 +02:00] [INF] [6] Emby.Server.Implementations.ScheduledTasks.TaskManager: Queuing task "ItemAddedScheduledTask"
[2021-05-05 14:45:45.605 +02:00] [INF] [27] Emby.Server.Implementations.ScheduledTasks.TaskManager: Executing "Webhook Item Added Notifier"
[2021-05-05 14:45:45.615 +02:00] [INF] [27] Emby.Server.Implementations.ScheduledTasks.TaskManager: "Webhook Item Added Notifier" Completed after 0 minute(s) and 0 seconds
[2021-05-05 14:45:45.676 +02:00] [INF] [27] Emby.Server.Implementations.ScheduledTasks.TaskManager: ExecuteQueuedTasks
[2021-05-05 14:46:15.614 +02:00] [INF] [12] Emby.Server.Implementations.ScheduledTasks.TaskManager: "IntervalTrigger" fired for task: "Webhook Item Added Notifier"
[2021-05-05 14:46:15.615 +02:00] [INF] [12] Emby.Server.Implementations.ScheduledTasks.TaskManager: Queuing task "ItemAddedScheduledTask"
[2021-05-05 14:46:15.615 +02:00] [INF] [5] Emby.Server.Implementations.ScheduledTasks.TaskManager: Executing "Webhook Item Added Notifier"
[2021-05-05 14:46:15.615 +02:00] [INF] [5] Emby.Server.Implementations.ScheduledTasks.TaskManager: "Webhook Item Added Notifier" Completed after 0 minute(s) and 0 seconds
[2021-05-05 14:46:15.616 +02:00] [INF] [5] Emby.Server.Implementations.ScheduledTasks.TaskManager: ExecuteQueuedTasks
[2021-05-05 14:46:18.217 +02:00] [WRN] [31] Jellyfin.Server.Middleware.ResponseTimeMiddleware: Slow HTTP Response from "https://*****/Auth/Keys" to "192.168.1.1" in 0:00:00.558514 with Status Code 200


[2021-05-05 14:49:28.727 +02:00] [INF] [1] Main: Jellyfin version: "10.7.5"
[2021-05-05 14:49:28.776 +02:00] [INF] [1] Main: Environment Variables: ["[JELLYFIN_DATA_DIR, /config/data]", "[JELLYFIN_LOG_DIR, /config/log]", "[DOTNET_SYSTEM_GLOBALIZATION_INVARIANT, 1]", "[JELLYFIN_CACHE_DIR, /config/cache]", "[JELLYFIN_CONFIG_DIR, /config]"]
[2021-05-05 14:49:28.784 +02:00] [INF] [1] Main: Arguments: ["/usr/lib/jellyfin/bin/jellyfin.dll", "--ffmpeg=/usr/lib/jellyfin-ffmpeg/ffmpeg", "--webdir=/usr/share/jellyfin/web"]
[2021-05-05 14:49:28.787 +02:00] [INF] [1] Main: Operating system: "Linux"
[2021-05-05 14:49:28.787 +02:00] [INF] [1] Main: Architecture: X64
[2021-05-05 14:49:28.789 +02:00] [INF] [1] Main: 64-Bit Process: True
[2021-05-05 14:49:28.789 +02:00] [INF] [1] Main: User Interactive: True
[2021-05-05 14:49:28.789 +02:00] [INF] [1] Main: Processor count: 4
[2021-05-05 14:49:28.789 +02:00] [INF] [1] Main: Program data path: "/config/data"
[2021-05-05 14:49:28.790 +02:00] [INF] [1] Main: Web resources path: "/usr/share/jellyfin/web"
[2021-05-05 14:49:28.790 +02:00] [INF] [1] Main: Application directory: "/usr/lib/jellyfin/bin/"
[2021-05-05 14:49:29.381 +02:00] [INF] [1] Emby.Server.Implementations.AppBase.BaseConfigurationManager: Setting cache path: "/config/cache"
[2021-05-05 14:49:29.515 +02:00] [INF] [1] Jellyfin.Networking.Manager.NetworkManager: Defined LAN addresses : "[127.0.0.1/8,10.0.0.0/8,172.16.0.0/12,192.168.0.0/16]"
[2021-05-05 14:49:29.515 +02:00] [INF] [1] Jellyfin.Networking.Manager.NetworkManager: Defined LAN exclusions : "[]"
[2021-05-05 14:49:29.517 +02:00] [INF] [1] Jellyfin.Networking.Manager.NetworkManager: Using LAN addresses: "[127.0.0.1/8,10.0.0.0/8,172.16.0.0/12,192.168.0.0/16]"
[2021-05-05 14:49:29.520 +02:00] [INF] [1] Jellyfin.Networking.Manager.NetworkManager: Using bind addresses: "[]"
[2021-05-05 14:49:29.520 +02:00] [INF] [1] Jellyfin.Networking.Manager.NetworkManager: Using bind exclusions: "[]"
[2021-05-05 14:49:29.687 +02:00] [INF] [1] Emby.Server.Implementations.ApplicationHost: Loading assemblies
[2021-05-05 14:49:29.723 +02:00] [INF] [1] Emby.Server.Implementations.Plugins.PluginManager: Loaded assembly "Emby.AutoOrganize, Version=9.0.0.0, Culture=neutral, PublicKeyToken=null" from "/config/data/plugins/Auto Organize_9.0.0.0/Emby.AutoOrganize.dll"
[2021-05-05 14:49:29.727 +02:00] [INF] [1] Emby.Server.Implementations.Plugins.PluginManager: Loaded assembly "LiteDB, Version=4.1.4.0, Culture=neutral, PublicKeyToken=4ee40123013c9f27" from "/config/data/plugins/Kodi Sync Queue_6.0.0.0/LiteDB.dll"
[2021-05-05 14:49:29.729 +02:00] [INF] [1] Emby.Server.Implementations.Plugins.PluginManager: Loaded assembly "Jellyfin.Plugin.KodiSyncQueue, Version=6.0.0.0, Culture=neutral, PublicKeyToken=null" from "/config/data/plugins/Kodi Sync Queue_6.0.0.0/Jellyfin.Plugin.KodiSyncQueue.dll"
[2021-05-05 14:49:29.730 +02:00] [INF] [1] Emby.Server.Implementations.Plugins.PluginManager: Loaded assembly "Jellyfin.Plugin.OpenSubtitles, Version=10.0.0.0, Culture=neutral, PublicKeyToken=null" from "/config/data/plugins/Open Subtitles_10.0.0.0/Jellyfin.Plugin.OpenSubtitles.dll"
[2021-05-05 14:49:29.732 +02:00] [INF] [1] Emby.Server.Implementations.Plugins.PluginManager: Loaded assembly "OpenSubtitlesHandler, Version=0.0.0.0, Culture=neutral, PublicKeyToken=null" from "/config/data/plugins/Open Subtitles_10.0.0.0/OpenSubtitlesHandler.dll"
[2021-05-05 14:49:29.735 +02:00] [INF] [1] Emby.Server.Implementations.Plugins.PluginManager: Loaded assembly "TvDbSharper, Version=3.2.2.0, Culture=neutral, PublicKeyToken=null" from "/config/data/plugins/TheTVDB_4.0.0.0/TvDbSharper.dll"
[2021-05-05 14:49:29.744 +02:00] [INF] [1] Emby.Server.Implementations.Plugins.PluginManager: Loaded assembly "Jellyfin.Plugin.Tvdb, Version=4.0.0.0, Culture=neutral, PublicKeyToken=null" from "/config/data/plugins/TheTVDB_4.0.0.0/Jellyfin.Plugin.Tvdb.dll"
[2021-05-05 14:49:29.747 +02:00] [INF] [1] Emby.Server.Implementations.Plugins.PluginManager: Loaded assembly "Trakt, Version=11.0.0.0, Culture=neutral, PublicKeyToken=null" from "/config/data/plugins/Trakt_11.0.0.0/Trakt.dll"
[2021-05-05 14:49:29.764 +02:00] [INF] [1] Emby.Server.Implementations.Plugins.PluginManager: Loaded assembly "Handlebars, Version=2.0.4.0, Culture=neutral, PublicKeyToken=22225d0bf33cd661" from "/config/data/plugins/Webhook_2.2021.409.38/Handlebars.dll"
[2021-05-05 14:49:29.812 +02:00] [INF] [1] Emby.Server.Implementations.Plugins.PluginManager: Loaded assembly "BouncyCastle.Crypto, Version=1.8.8.0, Culture=neutral, PublicKeyToken=0e99375e54769942" from "/config/data/plugins/Webhook_2.2021.409.38/BouncyCastle.Crypto.dll"
[2021-05-05 14:49:29.827 +02:00] [INF] [1] Emby.Server.Implementations.Plugins.PluginManager: Loaded assembly "MimeKit, Version=2.10.0.0, Culture=neutral, PublicKeyToken=bede1c8a46c66814" from "/config/data/plugins/Webhook_2.2021.409.38/MimeKit.dll"
[2021-05-05 14:49:29.832 +02:00] [INF] [1] Emby.Server.Implementations.Plugins.PluginManager: Loaded assembly "Jellyfin.Plugin.Webhook, Version=2.2021.409.38, Culture=neutral, PublicKeyToken=null" from "/config/data/plugins/Webhook_2.2021.409.38/Jellyfin.Plugin.Webhook.dll"
[2021-05-05 14:49:29.851 +02:00] [INF] [1] Emby.Server.Implementations.Plugins.PluginManager: Loaded assembly "MailKit, Version=2.10.0.0, Culture=neutral, PublicKeyToken=4e064fe7c44a8f1b" from "/config/data/plugins/Webhook_2.2021.409.38/MailKit.dll"
[2021-05-05 14:49:37.206 +02:00] [INF] [1] Emby.Server.Implementations.Plugins.PluginManager: Loaded plugin: "Auto Organize" "9.0.0.0"
[2021-05-05 14:49:37.209 +02:00] [INF] [1] Jellyfin.Plugin.KodiSyncQueue.Data.DbRepo: Jellyfin.Plugin.KodiSyncQueue is now starting
[2021-05-05 14:49:37.210 +02:00] [INF] [1] Jellyfin.Plugin.KodiSyncQueue.Data.DbRepo: Creating DB Repository...
[2021-05-05 14:49:37.235 +02:00] [INF] [1] Emby.Server.Implementations.Plugins.PluginManager: Loaded plugin: "Kodi Sync Queue" "6.0.0.0"
[2021-05-05 14:49:37.238 +02:00] [INF] [1] Emby.Server.Implementations.Plugins.PluginManager: Loaded plugin: "Open Subtitles" "10.0.0.0"
[2021-05-05 14:49:37.240 +02:00] [INF] [1] Emby.Server.Implementations.Plugins.PluginManager: Loaded plugin: "TheTVDB" "4.0.0.0"
[2021-05-05 14:49:37.242 +02:00] [INF] [1] Emby.Server.Implementations.Plugins.PluginManager: Loaded plugin: "Trakt" "11.0.0.0"
[2021-05-05 14:49:37.245 +02:00] [INF] [1] Emby.Server.Implementations.Plugins.PluginManager: Loaded plugin: "Webhook" "2.2021.409.38"
[2021-05-05 14:49:37.247 +02:00] [INF] [1] Emby.Server.Implementations.Plugins.PluginManager: Loaded plugin: "OMDb" "10.7.5.0"
[2021-05-05 14:49:37.249 +02:00] [INF] [1] Emby.Server.Implementations.Plugins.PluginManager: Loaded plugin: "MusicBrainz" "10.7.5.0"
[2021-05-05 14:49:37.251 +02:00] [INF] [1] Emby.Server.Implementations.Plugins.PluginManager: Loaded plugin: "AudioDB" "10.7.5.0"
[2021-05-05 14:49:37.544 +02:00] [INF] [1] Main: Kestrel listening on "Any IP4 Address"
[2021-05-05 14:49:38.494 +02:00] [WRN] [1] Microsoft.AspNetCore.DataProtection.Repositories.EphemeralXmlRepository: Using an in-memory repository. Keys will not be persisted to storage.
[2021-05-05 14:49:38.495 +02:00] [WRN] [1] Microsoft.AspNetCore.DataProtection.KeyManagement.XmlKeyManager: Neither user profile nor HKLM registry available. Using an ephemeral key repository. Protected data will be unavailable when application exits.
[2021-05-05 14:49:38.528 +02:00] [WRN] [1] Microsoft.AspNetCore.DataProtection.KeyManagement.XmlKeyManager: No XML encryptor configured. Key {61b2d998-ae88-4c64-a281-15951c175cec} may be persisted to storage in unencrypted form.
[2021-05-05 14:49:38.624 +02:00] [INF] [1] Emby.Server.Implementations.ApplicationHost: Running startup tasks
[2021-05-05 14:49:38.627 +02:00] [INF] [1] Jellyfin.Plugin.KodiSyncQueue.ScheduledTasks.FireRetentionTask: Retention Task Scheduled!
[2021-05-05 14:49:38.800 +02:00] [INF] [1] Emby.Server.Implementations.ScheduledTasks.TaskManager: Daily trigger for "Remove Old Sync Data" set to fire at 05/06/2021 00:01, which is 9:11:21.199962 from now.
[2021-05-05 14:49:38.848 +02:00] [INF] [1] Emby.Server.Implementations.ScheduledTasks.TaskManager: Daily trigger for "Hoofdstukafbeeldingen Uitpakken" set to fire at 05/06/2021 02:00, which is 11:10:21.1519761 from now.
[2021-05-05 14:49:39.117 +02:00] [INF] [1] MediaBrowser.MediaEncoding.Encoder.MediaEncoder: Found ffmpeg version "4.3.1"
[2021-05-05 14:49:39.190 +02:00] [INF] [1] MediaBrowser.MediaEncoding.Encoder.MediaEncoder: Available "decoders": ["h264", "h264_qsv", "h264_cuvid", "hevc", "hevc_qsv", "hevc_cuvid", "mpeg2video", "mpeg2_qsv", "mpeg2_cuvid", "mpeg4", "mpeg4_cuvid", "msmpeg4", "vc1_qsv", "vc1_cuvid", "vp8_cuvid", "vp8_qsv", "vp9_cuvid", "vp9_qsv", "aac", "ac3", "flac", "mp3"]
[2021-05-05 14:49:39.218 +02:00] [INF] [1] MediaBrowser.MediaEncoding.Encoder.MediaEncoder: Available "encoders": ["libx264", "h264_amf", "h264_nvenc", "h264_qsv", "h264_v4l2m2m", "h264_vaapi", "libx265", "hevc_amf", "hevc_nvenc", "hevc_qsv", "hevc_vaapi", "mpeg4", "msmpeg4", "libvpx", "libvpx-vp9", "aac", "ac3", "flac", "libmp3lame", "libopus", "libvorbis", "srt"]
[2021-05-05 14:49:39.245 +02:00] [INF] [1] MediaBrowser.MediaEncoding.Encoder.MediaEncoder: Available hwaccel types: ["vdpau", "cuda", "vaapi", "qsv", "drm", "opencl"]
[2021-05-05 14:49:39.247 +02:00] [INF] [1] MediaBrowser.MediaEncoding.Encoder.MediaEncoder: FFmpeg: Custom: "/usr/lib/jellyfin-ffmpeg/ffmpeg"
[2021-05-05 14:49:39.250 +02:00] [INF] [1] Emby.Server.Implementations.ApplicationHost: ServerId: "22a8705c1a264ef9a7ec8161e3775f33"
[2021-05-05 14:49:39.547 +02:00] [INF] [1] Emby.Server.Implementations.ApplicationHost: Executed all pre-startup entry points in 0:00:00.2570131
[2021-05-05 14:49:39.547 +02:00] [INF] [1] Emby.Server.Implementations.ApplicationHost: Core startup complete
[2021-05-05 14:49:39.556 +02:00] [INF] [1] Emby.AutoOrganize.Data.SqliteFileOrganizationRepository: SQLite version: "3.33.0"
[2021-05-05 14:49:39.558 +02:00] [INF] [1] Emby.AutoOrganize.Data.SqliteFileOrganizationRepository: SQLite compiler options: "COMPILER=gcc-5.4.0 20160609,DEFAULT_FOREIGN_KEYS,ENABLE_COLUMN_METADATA,ENABLE_FTS3_PARENTHESIS,ENABLE_FTS4,ENABLE_FTS5,ENABLE_JSON1,ENABLE_RTREE,THREADSAFE=1"
[2021-05-05 14:49:39.563 +02:00] [INF] [1] Emby.AutoOrganize.Data.SqliteFileOrganizationRepository: Default journal_mode for "/config/data/data/fileorganization.db" is "wal"
[2021-05-05 14:49:39.565 +02:00] [INF] [1] Emby.AutoOrganize.Data.SqliteFileOrganizationRepository: PRAGMA synchronous="1"
[2021-05-05 14:49:39.635 +02:00] [INF] [1] Jellyfin.Plugin.KodiSyncQueue.EntryPoints.LibrarySyncNotification: LibrarySyncNotification Startup...
[2021-05-05 14:49:39.637 +02:00] [INF] [1] Jellyfin.Plugin.KodiSyncQueue.EntryPoints.UserSyncNotification: UserSyncNotification Startup...
[2021-05-05 14:49:40.177 +02:00] [INF] [1] Emby.Server.Implementations.IO.LibraryMonitor: Skipping realtime monitor for "/*****" because the path does not exist
[2021-05-05 14:49:40.188 +02:00] [INF] [1] Emby.Server.Implementations.EntryPoints.ExternalPortForwarding: Starting NAT discovery
[2021-05-05 14:49:40.199 +02:00] [INF] [11] Emby.Server.Implementations.IO.LibraryMonitor: Watching directory /*****
[2021-05-05 14:49:40.223 +02:00] [INF] [8] Emby.Server.Implementations.IO.LibraryMonitor: Watching directory /*****
[2021-05-05 14:49:40.225 +02:00] [INF] [11] Emby.Server.Implementations.IO.LibraryMonitor: Watching directory /*****
[2021-05-05 14:49:40.240 +02:00] [INF] [11] Emby.Server.Implementations.IO.LibraryMonitor: Watching directory /*****
[2021-05-05 14:49:40.244 +02:00] [INF] [8] Emby.Server.Implementations.IO.LibraryMonitor: Watching directory /*****
[2021-05-05 14:49:40.251 +02:00] [INF] [11] Emby.Server.Implementations.IO.LibraryMonitor: Watching directory /*****
[2021-05-05 14:49:40.260 +02:00] [INF] [11] Emby.Server.Implementations.IO.LibraryMonitor: Watching directory /*****
[2021-05-05 14:49:40.290 +02:00] [INF] [8] Emby.Server.Implementations.IO.LibraryMonitor: Watching directory /*****
[2021-05-05 14:49:40.315 +02:00] [INF] [4] Emby.Server.Implementations.IO.LibraryMonitor: Watching directory /*****
[2021-05-05 14:49:40.340 +02:00] [INF] [12] Emby.Server.Implementations.IO.LibraryMonitor: Watching directory/*****
[2021-05-05 14:49:40.372 +02:00] [INF] [1] Emby.Server.Implementations.ApplicationHost: Executed all post-startup entry points in 0:00:00.8242141
[2021-05-05 14:49:40.373 +02:00] [INF] [1] Main: Startup complete 0:00:12.3264027
[2021-05-05 14:49:41.858 +02:00] [INF] [11] Emby.Server.Implementations.ScheduledTasks.TaskManager: "StartupTrigger" fired for task: "Update Plugins"
[2021-05-05 14:49:41.861 +02:00] [INF] [11] Emby.Server.Implementations.ScheduledTasks.TaskManager: Queuing task "PluginUpdateTask"
[2021-05-05 14:49:41.870 +02:00] [INF] [12] Emby.Server.Implementations.ScheduledTasks.TaskManager: Executing "Update Plugins"
[2021-05-05 14:49:43.371 +02:00] [INF] [12] Emby.Server.Implementations.ScheduledTasks.TaskManager: "Update Plugins" Completed after 0 minute(s) and 1 seconds
[2021-05-05 14:49:43.448 +02:00] [INF] [12] Emby.Server.Implementations.ScheduledTasks.TaskManager: ExecuteQueuedTasks
[2021-05-05 14:49:47.520 +02:00] [INF] [2] Main: Received a SIGTERM signal, shutting down
[2021-05-05 14:49:47.529 +02:00] [INF] [2] Emby.Server.Implementations.ApplicationHost: Disposing "CoreAppHost"
[2021-05-05 14:49:47.531 +02:00] [INF] [2] Emby.Server.Implementations.ApplicationHost: Disposing "EmbyTV"
[2021-05-05 14:49:47.534 +02:00] [INF] [2] Emby.Server.Implementations.ApplicationHost: Disposing "PluginEntryPoint"
[2021-05-05 14:49:47.548 +02:00] [INF] [2] Emby.Server.Implementations.IO.LibraryMonitor: Stopping directory watching for path "/*****"
[2021-05-05 14:49:47.555 +02:00] [INF] [2] Emby.Server.Implementations.IO.LibraryMonitor: Stopping directory watching for path "/*****"
[2021-05-05 14:49:47.556 +02:00] [INF] [2] Emby.Server.Implementations.IO.LibraryMonitor: Stopping directory watching for path "/*****"
[2021-05-05 14:49:47.557 +02:00] [INF] [2] Emby.Server.Implementations.IO.LibraryMonitor: Stopping directory watching for path "/*****"
[2021-05-05 14:49:47.559 +02:00] [INF] [2] Emby.Server.Implementations.IO.LibraryMonitor: Stopping directory watching for path "/*****"
[2021-05-05 14:49:47.560 +02:00] [INF] [2] Emby.Server.Implementations.IO.LibraryMonitor: Stopping directory watching for path "/*****"
[2021-05-05 14:49:47.561 +02:00] [INF] [2] Emby.Server.Implementations.IO.LibraryMonitor: Stopping directory watching for path "/*****"
[2021-05-05 14:49:47.562 +02:00] [INF] [2] Emby.Server.Implementations.IO.LibraryMonitor: Stopping directory watching for path "/*****"
[2021-05-05 14:49:47.562 +02:00] [INF] [2] Emby.Server.Implementations.IO.LibraryMonitor: Stopping directory watching for path "/*****"
[2021-05-05 14:49:47.563 +02:00] [INF] [2] Emby.Server.Implementations.IO.LibraryMonitor: Stopping directory watching for path "/*****"
[2021-05-05 14:49:47.565 +02:00] [INF] [2] Emby.Server.Implementations.ApplicationHost: Disposing "LibrarySyncNotification"
[2021-05-05 14:49:47.568 +02:00] [INF] [2] Emby.Server.Implementations.ApplicationHost: Disposing "UserSyncNotification"
[2021-05-05 14:49:47.572 +02:00] [INF] [2] Emby.Server.Implementations.ApplicationHost: Disposing "TvdbMissingEpisodeProvider"
[2021-05-05 14:49:47.574 +02:00] [INF] [2] Emby.Server.Implementations.ApplicationHost: Disposing "ServerMediator"
[2021-05-05 14:49:47.577 +02:00] [INF] [2] Emby.Server.Implementations.ApplicationHost: Disposing "ItemAddedNotifierEntryPoint"
[2021-05-05 14:49:47.578 +02:00] [INF] [2] Emby.Server.Implementations.ApplicationHost: Disposing "EntryPoint"
[2021-05-05 14:49:47.579 +02:00] [INF] [2] Emby.Server.Implementations.ApplicationHost: Disposing "LibraryMonitorStartup"
[2021-05-05 14:49:47.580 +02:00] [INF] [2] Emby.Server.Implementations.ApplicationHost: Disposing "ExternalPortForwarding"
[2021-05-05 14:49:47.584 +02:00] [INF] [2] Emby.Server.Implementations.EntryPoints.ExternalPortForwarding: Stopping NAT discovery
[2021-05-05 14:49:47.596 +02:00] [INF] [2] Emby.Server.Implementations.ApplicationHost: Disposing "LibraryChangedNotifier"
[2021-05-05 14:49:47.599 +02:00] [INF] [2] Emby.Server.Implementations.ApplicationHost: Disposing "RecordingNotifier"
[2021-05-05 14:49:47.603 +02:00] [INF] [2] Emby.Server.Implementations.ApplicationHost: Disposing "UdpServerEntryPoint"
[2021-05-05 14:49:47.609 +02:00] [INF] [2] Emby.Server.Implementations.ApplicationHost: Disposing "UserDataChangeNotifier"
[2021-05-05 14:49:47.610 +02:00] [INF] [2] Emby.Server.Implementations.ApplicationHost: Disposing "DlnaEntryPoint"
[2021-05-05 14:49:47.612 +02:00] [INF] [2] Emby.Dlna.Main.DlnaEntryPoint: Disposing DeviceDiscovery
[2021-05-05 14:49:47.614 +02:00] [INF] [2] Emby.Dlna.Main.DlnaEntryPoint: Disposing SsdpCommunicationsServer
[2021-05-05 14:49:47.615 +02:00] [INF] [2] Emby.Dlna.Main.DlnaEntryPoint: "SsdpCommunicationsServer" disposing _BroadcastListenSocket
[2021-05-05 14:49:47.618 +02:00] [INF] [2] Emby.Dlna.Main.DlnaEntryPoint: "SsdpCommunicationsServer" Disposing 2 sendSockets
[2021-05-05 14:49:47.618 +02:00] [INF] [2] Emby.Dlna.Main.DlnaEntryPoint: "SsdpCommunicationsServer" disposing sendSocket from "0.0.0.0"
[2021-05-05 14:49:47.618 +02:00] [INF] [2] Emby.Dlna.Main.DlnaEntryPoint: "SsdpCommunicationsServer" disposing sendSocket from "192.168.xx.xx"
[2021-05-05 14:49:47.619 +02:00] [INF] [2] Emby.Server.Implementations.ApplicationHost: Disposing "NotificationEntryPoint"
[2021-05-05 14:49:47.622 +02:00] [INF] [2] Emby.Server.Implementations.ApplicationHost: Disposing "EntryPoint"
[2021-05-05 14:49:47.623 +02:00] [INF] [2] Emby.Server.Implementations.ApplicationHost: Disposing "DeviceAccessEntryPoint"
[2021-05-05 14:50:34.846 +02:00] [INF] [1] Main: Jellyfin version: "10.7.2"
[2021-05-05 14:50:34.898 +02:00] [INF] [1] Main: Environment Variables: ["[JELLYFIN_DATA_DIR, /config/data]", "[JELLYFIN_LOG_DIR, /config/log]", "[JELLYFIN_CACHE_DIR, /config/cache]", "[JELLYFIN_CONFIG_DIR, /config]", "[DOTNET_SYSTEM_GLOBALIZATION_INVARIANT, 1]"]
[2021-05-05 14:50:34.907 +02:00] [INF] [1] Main: Arguments: ["/usr/lib/jellyfin/bin/jellyfin.dll", "--ffmpeg=/usr/lib/jellyfin-ffmpeg/ffmpeg", "--webdir=/usr/share/jellyfin/web"]
[2021-05-05 14:50:34.909 +02:00] [INF] [1] Main: Operating system: "Linux"
[2021-05-05 14:50:34.909 +02:00] [INF] [1] Main: Architecture: X64
[2021-05-05 14:50:34.911 +02:00] [INF] [1] Main: 64-Bit Process: True
[2021-05-05 14:50:34.911 +02:00] [INF] [1] Main: User Interactive: True
[2021-05-05 14:50:34.911 +02:00] [INF] [1] Main: Processor count: 4
[2021-05-05 14:50:34.911 +02:00] [INF] [1] Main: Program data path: "/config/data"
[2021-05-05 14:50:34.912 +02:00] [INF] [1] Main: Web resources path: "/usr/share/jellyfin/web"
[2021-05-05 14:50:34.912 +02:00] [INF] [1] Main: Application directory: "/usr/lib/jellyfin/bin/"
[2021-05-05 14:50:35.524 +02:00] [INF] [1] Emby.Server.Implementations.AppBase.BaseConfigurationManager: Setting cache path: "/config/cache"
[2021-05-05 14:50:35.653 +02:00] [INF] [1] Jellyfin.Networking.Manager.NetworkManager: Defined LAN addresses : "[127.0.0.1/8,10.0.0.0/8,172.16.0.0/12,192.168.0.0/16]"
[2021-05-05 14:50:35.654 +02:00] [INF] [1] Jellyfin.Networking.Manager.NetworkManager: Defined LAN exclusions : "[]"
[2021-05-05 14:50:35.656 +02:00] [INF] [1] Jellyfin.Networking.Manager.NetworkManager: Using LAN addresses: "[127.0.0.1/8,10.0.0.0/8,172.16.0.0/12,192.168.0.0/16]"
[2021-05-05 14:50:35.659 +02:00] [INF] [1] Jellyfin.Networking.Manager.NetworkManager: Using bind addresses: "[]"
[2021-05-05 14:50:35.659 +02:00] [INF] [1] Jellyfin.Networking.Manager.NetworkManager: Using bind exclusions: "[]"
[2021-05-05 14:50:35.809 +02:00] [INF] [1] Emby.Server.Implementations.ApplicationHost: Loading assemblies
[2021-05-05 14:50:35.841 +02:00] [INF] [1] Emby.Server.Implementations.Plugins.PluginManager: Loaded assembly "Emby.AutoOrganize, Version=9.0.0.0, Culture=neutral, PublicKeyToken=null" from "/config/data/plugins/Auto Organize_9.0.0.0/Emby.AutoOrganize.dll"
[2021-05-05 14:50:35.846 +02:00] [INF] [1] Emby.Server.Implementations.Plugins.PluginManager: Loaded assembly "LiteDB, Version=4.1.4.0, Culture=neutral, PublicKeyToken=4ee40123013c9f27" from "/config/data/plugins/Kodi Sync Queue_6.0.0.0/LiteDB.dll"
[2021-05-05 14:50:35.847 +02:00] [INF] [1] Emby.Server.Implementations.Plugins.PluginManager: Loaded assembly "Jellyfin.Plugin.KodiSyncQueue, Version=6.0.0.0, Culture=neutral, PublicKeyToken=null" from "/config/data/plugins/Kodi Sync Queue_6.0.0.0/Jellyfin.Plugin.KodiSyncQueue.dll"
[2021-05-05 14:50:35.849 +02:00] [INF] [1] Emby.Server.Implementations.Plugins.PluginManager: Loaded assembly "Jellyfin.Plugin.OpenSubtitles, Version=10.0.0.0, Culture=neutral, PublicKeyToken=null" from "/config/data/plugins/Open Subtitles_10.0.0.0/Jellyfin.Plugin.OpenSubtitles.dll"
[2021-05-05 14:50:35.851 +02:00] [INF] [1] Emby.Server.Implementations.Plugins.PluginManager: Loaded assembly "OpenSubtitlesHandler, Version=0.0.0.0, Culture=neutral, PublicKeyToken=null" from "/config/data/plugins/Open Subtitles_10.0.0.0/OpenSubtitlesHandler.dll"
[2021-05-05 14:50:35.854 +02:00] [INF] [1] Emby.Server.Implementations.Plugins.PluginManager: Loaded assembly "TvDbSharper, Version=3.2.2.0, Culture=neutral, PublicKeyToken=null" from "/config/data/plugins/TheTVDB_4.0.0.0/TvDbSharper.dll"
[2021-05-05 14:50:35.861 +02:00] [INF] [1] Emby.Server.Implementations.Plugins.PluginManager: Loaded assembly "Jellyfin.Plugin.Tvdb, Version=4.0.0.0, Culture=neutral, PublicKeyToken=null" from "/config/data/plugins/TheTVDB_4.0.0.0/Jellyfin.Plugin.Tvdb.dll"
[2021-05-05 14:50:35.865 +02:00] [INF] [1] Emby.Server.Implementations.Plugins.PluginManager: Loaded assembly "Trakt, Version=11.0.0.0, Culture=neutral, PublicKeyToken=null" from "/config/data/plugins/Trakt_11.0.0.0/Trakt.dll"
[2021-05-05 14:50:35.881 +02:00] [INF] [1] Emby.Server.Implementations.Plugins.PluginManager: Loaded assembly "Handlebars, Version=2.0.4.0, Culture=neutral, PublicKeyToken=22225d0bf33cd661" from "/config/data/plugins/Webhook_2.2021.409.38/Handlebars.dll"
[2021-05-05 14:50:35.928 +02:00] [INF] [1] Emby.Server.Implementations.Plugins.PluginManager: Loaded assembly "BouncyCastle.Crypto, Version=1.8.8.0, Culture=neutral, PublicKeyToken=0e99375e54769942" from "/config/data/plugins/Webhook_2.2021.409.38/BouncyCastle.Crypto.dll"
[2021-05-05 14:50:35.945 +02:00] [INF] [1] Emby.Server.Implementations.Plugins.PluginManager: Loaded assembly "MimeKit, Version=2.10.0.0, Culture=neutral, PublicKeyToken=bede1c8a46c66814" from "/config/data/plugins/Webhook_2.2021.409.38/MimeKit.dll"
[2021-05-05 14:50:35.951 +02:00] [INF] [1] Emby.Server.Implementations.Plugins.PluginManager: Loaded assembly "Jellyfin.Plugin.Webhook, Version=2.2021.409.38, Culture=neutral, PublicKeyToken=null" from "/config/data/plugins/Webhook_2.2021.409.38/Jellyfin.Plugin.Webhook.dll"
[2021-05-05 14:50:35.969 +02:00] [INF] [1] Emby.Server.Implementations.Plugins.PluginManager: Loaded assembly "MailKit, Version=2.10.0.0, Culture=neutral, PublicKeyToken=4e064fe7c44a8f1b" from "/config/data/plugins/Webhook_2.2021.409.38/MailKit.dll"
```

**Comment by BaronGreenback** [comment]
The discovery broadcast is sent out at specific intervals specified by the ClientDiscoveryIntervalSeconds parameter in the dlna.xml config file.

It's highlighted the fact that this config has no min value which could result in a DOS.

Could you post what value you have against ClientDiscoveryIntervalSeconds in the dlna.xml configuration file please, as i don't think this is the cause of your problem if the earlier version has changed.

**Comment by Tezzlicious** [comment]
<?xml version="1.0" encoding="utf-8"?>
<DlnaOptions xmlns:xsi="http://www.w3.org/2001/XMLSchema-instance" xmlns:xsd="http://www.w3.org/2001/XMLSchema">
  <EnablePlayTo>false</EnablePlayTo>
  <EnableServer>false</EnableServer>
  <EnableDebugLog>false</EnableDebugLog>
  <EnablePlayToTracing>false</EnablePlayToTracing>
  <ClientDiscoveryIntervalSeconds>60</ClientDiscoveryIntervalSeconds>
  <AliveMessageIntervalSeconds>1800</AliveMessageIntervalSeconds>
  <BlastAliveMessageIntervalSeconds>1800</BlastAliveMessageIntervalSeconds>
  <AutoCreatePlayToProfiles>false</AutoCreatePlayToProfiles>
  <BlastAliveMessages>false</BlastAliveMessages>
  <SendOnlyMatchedHost>true</SendOnlyMatchedHost>
</DlnaOptions>

**Comment by Tezzlicious** [comment]
```
<?xml version="1.0" encoding="utf-8"?>
<DlnaOptions xmlns:xsi="http://www.w3.org/2001/XMLSchema-instance" xmlns:xsd="http://www.w3.org/2001/XMLSchema">
  <EnablePlayTo>false</EnablePlayTo>
  <EnableServer>false</EnableServer>
  <EnableDebugLog>false</EnableDebugLog>
  <EnablePlayToTracing>false</EnablePlayToTracing>
  <ClientDiscoveryIntervalSeconds>60</ClientDiscoveryIntervalSeconds>
  <AliveMessageIntervalSeconds>1800</AliveMessageIntervalSeconds>
  <BlastAliveMessageIntervalSeconds>1800</BlastAliveMessageIntervalSeconds>
  <AutoCreatePlayToProfiles>false</AutoCreatePlayToProfiles>
  <BlastAliveMessages>false</BlastAliveMessages>
  <SendOnlyMatchedHost>true</SendOnlyMatchedHost>
</DlnaOptions>
```

**Comment by BaronGreenback** [comment]
Is EnableUPnP set to true in network.xml by any chance?

**Comment by Tezzlicious** [comment]
Yeah:   <EnableUPnP>true</EnableUPnP>

**Comment by BaronGreenback** [comment]
Could you set it to false and see if the broadcast storm stops? I think i know what the issue might be.

**Comment by Tezzlicious** [comment]
Yes, that stops the flooding.

**Comment by BaronGreenback** [comment]
The ssdp sub-system still runs even if the dlna and playTo are disabled. (Fixed in a future release).

Ssdp and UPnP work cooperatively in this release to speed up network detection. However, no checking is done to see what kind of message is being received before UPnP is notified.

Ssdp is sending out an I'm here, and notifying UPnP, which does likewise.
Ssdp is then picking up the UPnP message and notifying UPnP again - which sends out another request. Rinse and repeat.

**Comment by cvium** [comment]
Fixed in master and in 10.7.6 (ETA unknown)
